Choices,Label,Res 1,Pred 1,Res 2,Pred 2,Res 3,Pred 3,Res 4,Pred 4,Res 5,Pred 5
"['""I think you\'re being quite unprofessional""', '“Let another person present first. You can do it another time.""', '""It\'s alright! Take a deep breath before continuing.""', '""I\'m here for you. Do you want to visit a therapist?""']",2,"“Let another person present first. You can do it another time.""",-1,"“Let another person present first. You can do it another time.""",-1,"“Let another person present first. You can do it another time.""",-1,"“Let another person present first. You can do it another time.""",-1,"""It's alright! Take a deep breath before continuing.""",-1
"['""It sounds really sad to be so lonely""', '""I can introduce you to some other neighbors""', '""You won\'t be lonely as long as I\'m here""', '""I think adopting a dog would help""']",1,"""I think adopting a dog would help""",3,"""It sounds really sad to be so lonely""",0,"""You won't be lonely as long as I'm here""",2,"""I can introduce you to some other neighbors""",1,"""I can introduce you to some other neighbors""",1
"['""I think you need to ask them out yourself""', '""Do you want to hang out together this Saturday?""', '""I think it\'s better if you changed your attitude, that way people would like you more""', '""That sounds hard, I\'m sorry to hear that""']",1,"""I think you need to ask them out yourself""",0,"""I think you need to ask them out yourself""",0,"""I think it's better if you changed your attitude, that way people would like you more""",2,"""That sounds hard, I'm sorry to hear that""",3,"""Do you want to hang out together this Saturday?""",1
"['""Complaining won\'t change anything""', '""How about talking to the boss about this?""', '""Maybe we just need to work harder""', '""I think we need to adapt to a different management style""']",1,"""Complaining won't change anything""",0,"""I think we need to adapt to a different management style""",3,"""I think we need to adapt to a different management style""",3,"""I think we need to adapt to a different management style""",3,"""I think we need to adapt to a different management style""",3
"['""Time will heal the wounds. Hope you get to enjoy this lunch.""', '""I\'m so sorry for your loss, I\'m here if you need anything""', '""Will you be taking days off to attend her funeral?""', '""I know how you feel, my mom passed away too""']",1,"""Will you be taking days off to attend her funeral?""",2,"""I'm so sorry for your loss, I'm here if you need anything""",1,"""I know how you feel, my mom passed away too""",3,"""Will you be taking days off to attend her funeral?""",2,"""I know how you feel, my mom passed away too""",3
"['""I understand your frustration. Is there any way I could assist you?""', '""That\'s alright! I think if you try to work harder, you can meet your target.""', '""I\'m sorry to hear that. I\'m here to support you in any way you need. Would you like to take some of my sales for next month?""', '""That\'s unfortunate, maybe your strategy is not good to meet your target""']",0,"""I understand your frustration. Is there any way I could assist you?""",-1,"""I understand your frustration. Is there any way I could assist you?""",-1,"""I'm sorry to hear that. I'm here to support you in any way you need. Would you like to take some of my sales for next month?""",-1,"""I understand your frustration. Is there any way I could assist you?""",-1,"""That's unfortunate, maybe your strategy is not good to meet your target""",3
"['""You can just rewrite it""', '""I should\'ve reminded you to back up your work""', '""That must be so frustrating for you! Maybe you can ask an IT technician if they can help""', '""It\'s your fault that you did it on a public computer""']",2,"""I should've reminded you to back up your work""",1,"""It's your fault that you did it on a public computer""",3,"""It's your fault that you did it on a public computer""",3,"""I should've reminded you to back up your work""",1,"""You can just rewrite it""",0
"['""I think it\'s better to focus on work to shift your attention away from her""', '""She doesn\'t deserve a person as good as you""', '""I never liked her anyways, you deserve better""', '""I\'m really sorry to hear that. This must be hard on you, want to talk about it?""']",3,"""I'm really sorry to hear that. This must be hard on you, want to talk about it?""",-1,"""I'm really sorry to hear that. This must be hard on you, want to talk about it?""",-1,"""I think it's better to focus on work to shift your attention away from her""",0,"""I'm really sorry to hear that. This must be hard on you, want to talk about it?""",-1,"""She doesn't deserve a person as good as you""",1
"['""I can help you prepare for next time so you can get a grade like mine""', '""I know you put in a lot of effort for this exam, you just got unlucky""', '""Exams aren\'t everything, I hope you don\'t worry about it""', '""Don\'t worry, let\'s work hard together next time and strive to achieve better results""']",3,"""I know you put in a lot of effort for this exam, you just got unlucky""",1,"""I can help you prepare for next time so you can get a grade like mine""",0,"""Exams aren't everything, I hope you don't worry about it""",2,"""I know you put in a lot of effort for this exam, you just got unlucky""",1,"""I know you put in a lot of effort for this exam, you just got unlucky""",1
"['I think that you can get welfare and search for related resources.""', '""I\'m sorry to hear that, It’s okay to believe in your abilities and take the time to get through this difficult time.”', '""Oh, no, I\'m sorry to hear that, it must be very disappointing.""', '“This is not your fault, it’s just the economic environment. I can help you prepare to find a new job.”']",3,"I think that you can get welfare and search for related resources.""",-1,"“This is not your fault, it’s just the economic environment. I can help you prepare to find a new job.”",-1,"I think that you can get welfare and search for related resources.""",-1,"""I'm sorry to hear that, It’s okay to believe in your abilities and take the time to get through this difficult time.”",-1,"""Oh, no, I'm sorry to hear that, it must be very disappointing.""",-1
"['Tell his family he feels left out', 'Reflect that relationships can sometimes be fickle', 'Nothing, it will sort itself out soon enough', 'Spend time only listening']",0,Tell his family he feels left out,0,"Nothing, it will sort itself out soon enough",2,Tell his family he feels left out,0,"Nothing, it will sort itself out soon enough",2,Tell his family he feels left out,0
"['Help his wife find a job in the other country, convince her to quit her job and move with him', 'Regret applying for this job when he didn’t want to leave', 'Spend more time on work related to the new position to prepare for his new position', 'Plan systematic contact methods, such as regular phone calls or emails every week']",3,"Help his wife find a job in the other country, convince her to quit her job and move with him",0,"Plan systematic contact methods, such as regular phone calls or emails every week",3,"Plan systematic contact methods, such as regular phone calls or emails every week",3,"Help his wife find a job in the other country, convince her to quit her job and move with him",0,Spend more time on work related to the new position to prepare for his new position,2
"[""Party with his friends so he doesn't think about the impending surgery"", 'Talk to his doctor about what will happen', 'Talk to his family to get comfort about passing away', ""Find out as much as he can about the procedure and consider what's the worst that could happen""]",1,Talk to his doctor about what will happen,1,Talk to his doctor about what will happen,1,Find out as much as he can about the procedure and consider what's the worst that could happen,3,Party with his friends so he doesn't think about the impending surgery,0,Talk to his family to get comfort about passing away,2
"['Realize it was time to give up on this friendship and move on', 'Try to communicate with Kevin', 'Understand that people will change. So move on and keep the good times in memories', 'Play some interactive games with Kevin to warm up their relationship']",2,Try to communicate with Kevin,1,Play some interactive games with Kevin to warm up their relationship,3,Play some interactive games with Kevin to warm up their relationship,3,Try to communicate with Kevin,1,Understand that people will change. So move on and keep the good times in memories,-1
"['Talk to friends or relatives to ease his worries', 'Try to calm down, perhaps go for a short walk or meditate', 'Prepare ahead of time so he has everything he needs available', ""Accept that things aren't going to be perfect""]",2,"Try to calm down, perhaps go for a short walk or meditate",1,Accept that things aren't going to be perfect,3,Prepare ahead of time so he has everything he needs available,2,Talk to friends or relatives to ease his worries,0,Prepare ahead of time so he has everything he needs available,2
"['Wait until she has been around long enough and use this experience to get a promotion', 'Accept the rules and prove herself with strength', 'Ask management if they can make exceptions', 'Quit her job and give up this position']",2,Ask management if they can make exceptions,2,Accept the rules and prove herself with strength,1,Accept the rules and prove herself with strength,1,Wait until she has been around long enough and use this experience to get a promotion,0,Ask management if they can make exceptions,2
"['Pretend that everything is normal and things will get better', 'Gain confidence and not be anxious by talking to other people', 'Keep her situation secret from her parents', 'Discuss her anxiety with her parents and ask for their understanding']",3,Discuss her anxiety with her parents and ask for their understanding,3,Pretend that everything is normal and things will get better,0,Discuss her anxiety with her parents and ask for their understanding,3,Gain confidence and not be anxious by talking to other people,1,Discuss her anxiety with her parents and ask for their understanding,3
"['Realize her mistake and discuss with her ex to get back together so she can regain her focus', 'Open up to a trusted good friend to share her feelings', 'Adjust her mentality and try to concentrate at work', 'Try to find a partner in the same place to avoid long-distance issues']",1,Adjust her mentality and try to concentrate at work,2,Adjust her mentality and try to concentrate at work,2,Realize her mistake and discuss with her ex to get back together so she can regain her focus,0,Realize her mistake and discuss with her ex to get back together so she can regain her focus,0,Try to find a partner in the same place to avoid long-distance issues,3
"['Try to be honest with her parents about the problems she is facing', 'Try to solve her own problems on her own', 'Start looking for a non-profit therapist', 'Openly discuss her decision to receive therapy with her family and friends']",3,Start looking for a non-profit therapist,2,Try to be honest with her parents about the problems she is facing,0,Openly discuss her decision to receive therapy with her family and friends,3,Openly discuss her decision to receive therapy with her family and friends,3,Try to solve her own problems on her own,1
"['Discuss and seek advice from her boyfriend', 'Breakup with her boyfriend without explanation to avoid judgment', 'Avoid the other person to let the feelings dissipate', 'Discuss her feelings with her boyfriend']",3,Discuss her feelings with her boyfriend,3,Discuss and seek advice from her boyfriend,0,Avoid the other person to let the feelings dissipate,2,Breakup with her boyfriend without explanation to avoid judgment,1,Discuss and seek advice from her boyfriend,0
"['Assist in finding her sister a job and work together', 'Confront her sister about her spending habits', 'Keep lending money to her sister and work harder', 'Tell her sister she can no longer lend her money']",0,Tell her sister she can no longer lend her money,3,Assist in finding her sister a job and work together,0,Keep lending money to her sister and work harder,2,Confront her sister about her spending habits,1,Assist in finding her sister a job and work together,0
"['Break up with his girlfriend and bear the loneliness', 'Distract himself through work or hobbies and not think about his feelings', 'Spend time with friends and family, leaning on their support', 'Try to find a new partner before breaking up']",2,"Spend time with friends and family, leaning on their support",2,Try to find a new partner before breaking up,3,"Spend time with friends and family, leaning on their support",2,Break up with his girlfriend and bear the loneliness,0,Break up with his girlfriend and bear the loneliness,0
"['Break up with her to avoid potential conflict with parents', 'Discuss his intentions with her parents first', 'Hide the proposal to keep the peace with his family', 'Propose to his girlfriend and hope they approve']",1,Propose to his girlfriend and hope they approve,3,Break up with her to avoid potential conflict with parents,0,Hide the proposal to keep the peace with his family,2,Break up with her to avoid potential conflict with parents,0,Discuss his intentions with her parents first,1
"['Tell his wife immediately without considering her feelings', 'Look for an appropriate time and have a deep discussion on the matter', 'Keep it to himself as he knows it would hurt his wife', ""Ask for a divorce so she doesn't have to go through the pain""]",1,Tell his wife immediately without considering her feelings,0,Ask for a divorce so she doesn't have to go through the pain,3,Look for an appropriate time and have a deep discussion on the matter,1,Tell his wife immediately without considering her feelings,0,Keep it to himself as he knows it would hurt his wife,2
"['Openly communicate his problem with the other person and discuss marriage', 'Open up to the other person about this fear and seek comfort', 'Try to work on his emotions and fears by himself to become a better partner without this fear', 'Open up to his close friends and ask for their support']",1,Open up to his close friends and ask for their support,3,Try to work on his emotions and fears by himself to become a better partner without this fear,2,Openly communicate his problem with the other person and discuss marriage,0,Try to work on his emotions and fears by himself to become a better partner without this fear,2,Try to work on his emotions and fears by himself to become a better partner without this fear,2
"['Make sure he does not cheat by monitoring him', 'Reveal his past to their mutual friend and discuss their break up', ""Decide to keep quiet and not interfere in her friend's relationship"", ""Approach her friend's boyfriend and confront him about his past""]",2,Reveal his past to their mutual friend and discuss their break up,1,Make sure he does not cheat by monitoring him,0,Reveal his past to their mutual friend and discuss their break up,1,Make sure he does not cheat by monitoring him,0,Decide to keep quiet and not interfere in her friend's relationship,2
"['Go through with the wedding as she always dreamed of it', 'Postpone the wedding to a later date so she can prepare more', 'Try to handle everything and not bother her fiancé', 'Discuss and divide responsibilities with her fiancé']",3,Go through with the wedding as she always dreamed of it,0,Go through with the wedding as she always dreamed of it,0,Go through with the wedding as she always dreamed of it,0,Go through with the wedding as she always dreamed of it,0,Try to handle everything and not bother her fiancé,2
"[""Read into her friend's political viewpoints and try to understand and adopt them"", 'Try to disengage from any political conversations when talking with her friends', 'Have a discussion with her friends and explain her viewpoints', 'Ask her friends to share their opinions and have a conversation about it']",3,Have a discussion with her friends and explain her viewpoints,2,Ask her friends to share their opinions and have a conversation about it,3,Read into her friend's political viewpoints and try to understand and adopt them,0,Ask her friends to share their opinions and have a conversation about it,3,Ask her friends to share their opinions and have a conversation about it,3
"['Break up with his girlfriend and focus on his future', 'Wait until the situation improves to propose', 'Express his concerns and feelings to his girlfriend', 'Propose to her girlfriend and figure things out after marriage']",2,Break up with his girlfriend and focus on his future,0,Wait until the situation improves to propose,1,Break up with his girlfriend and focus on his future,0,Express his concerns and feelings to his girlfriend,2,Express his concerns and feelings to his girlfriend,2
"['Apologize to her friend and explain how she only used hurtful words as a defense mechanism', ""Ask for a conversation to discuss how each person's action led to the issues"", 'Ask for a conversation to discuss their feelings', 'Ask for a conversation to discuss their feelings while trying to find new friends']",2,Ask for a conversation to discuss their feelings,2,Ask for a conversation to discuss their feelings while trying to find new friends,2,Ask for a conversation to discuss their feelings,2,Apologize to her friend and explain how she only used hurtful words as a defense mechanism,0,Apologize to her friend and explain how she only used hurtful words as a defense mechanism,0
"['Practice patience and address the difficulties only when the argument phase passes', 'Express her feelings to her boyfriend', 'Break up with him and find a more understanding partner', 'Start ignoring all arguments']",1,Express her feelings to her boyfriend,1,Express her feelings to her boyfriend,1,Start ignoring all arguments,3,Break up with him and find a more understanding partner,2,Express her feelings to her boyfriend,1
"['Cut ties with both his girlfriend and best friend immediately', 'Confront both his girlfriend and his best friend about the issue', 'Seek guidance from other trustworthy friends or family members', ""Pretend like this didn't happen and continue life as normal""]",2,Cut ties with both his girlfriend and best friend immediately,0,Cut ties with both his girlfriend and best friend immediately,0,Seek guidance from other trustworthy friends or family members,2,Confront both his girlfriend and his best friend about the issue,1,Cut ties with both his girlfriend and best friend immediately,0
"['Find a new partner in her city', 'Try to plan more activities together online', 'Keep feelings to herself and hope it gets better', 'Demand her partner to move closer']",1,Keep feelings to herself and hope it gets better,2,Demand her partner to move closer,3,Find a new partner in her city,0,Demand her partner to move closer,3,Keep feelings to herself and hope it gets better,2
"['Urgently tell her boyfriend everything', 'Discuss her illness with a close friend first to get guidance', 'Not tell him anything until she feels that he can handle it', 'Break up with her boyfriend before telling him to avoid potential heartbreak']",1,Urgently tell her boyfriend everything,0,Break up with her boyfriend before telling him to avoid potential heartbreak,3,Not tell him anything until she feels that he can handle it,2,Discuss her illness with a close friend first to get guidance,1,Discuss her illness with a close friend first to get guidance,1
"['Start going out more and make new friends', 'Start taking medication to help with his sadness and loneliness', 'Find a therapist to help cope with his feelings', 'Start exercising daily to get his mind off of the breakup']",3,Start taking medication to help with his sadness and loneliness,1,Start exercising daily to get his mind off of the breakup,3,Start taking medication to help with his sadness and loneliness,1,Start exercising daily to get his mind off of the breakup,3,Start exercising daily to get his mind off of the breakup,3
"['""I understand, it\'s unfortunate but we can always celebrate some other time""', '""I understand, I wished you cared more about me""', '""This is unfair, you always do this!""', '""That\'s alright, work is definitely more important""']",0,"""I understand, I wished you cared more about me""",1,"""That's alright, work is definitely more important""",3,"""That's alright, work is definitely more important""",3,"""That's alright, work is definitely more important""",3,"""This is unfair, you always do this!""",2
"['""That\'s tough! Well, just do what you think it\'s the best for you.""', '""Let\'s go to a nice place. We can find something nice for you to eat""', '""I think we should find a professional to talk to""', '""You don\'t eat and that\'s why you are skinny! You should start eating more""']",2,"""I think we should find a professional to talk to""",2,"""I think we should find a professional to talk to""",2,"""Let's go to a nice place. We can find something nice for you to eat""",-1,"""I think we should find a professional to talk to""",2,"""Let's go to a nice place. We can find something nice for you to eat""",-1
"['""I completely understand, work can be demanding at times""', '""I completely understand, It seems our plans are not a priority for you""', '""You always choose work over our plans""', '""This is disappointing, but I don\'t understand why work is a priority sometimes""']",0,"""You always choose work over our plans""",2,"""You always choose work over our plans""",2,"""I completely understand, It seems our plans are not a priority for you""",1,"""You always choose work over our plans""",2,"""I completely understand, It seems our plans are not a priority for you""",1
"['""Will you reduce your workload next month?""', '""Do you think I should find other hobbies since you\'re busy?""', '""Can we discuss ways to spend more time together?""', '""I don\'t think I matter to you as much as the PhD""']",2,"""Do you think I should find other hobbies since you're busy?""",1,"""I don't think I matter to you as much as the PhD""",3,"""Will you reduce your workload next month?""",0,"""Can we discuss ways to spend more time together?""",2,"""I don't think I matter to you as much as the PhD""",3
"['""Oh don\'t worry, I can always get a new one.""', '""I don\'t know if I will ever recover from this""', '""I appreciate you telling me this. It\'s really hard to be without him but I will find a way to cope.""', '""I need to see that guy in jail for his actions""']",2,"""I appreciate you telling me this. It's really hard to be without him but I will find a way to cope.""",-1,"""Oh don't worry, I can always get a new one.""",-1,"""I appreciate you telling me this. It's really hard to be without him but I will find a way to cope.""",-1,"""Oh don't worry, I can always get a new one.""",-1,"""Oh don't worry, I can always get a new one.""",-1
"['“I don’t care about what you said about me, I know who I really am”', '“I heard you said bad things about me behind my back, can we have an honest conversation about why?”', '“I want to talk about what you said behind my back, and I hope we can solve the problem”', ""“I can’t believe you did this, I don't want to be friends anymore”""]",1,"“I heard you said bad things about me behind my back, can we have an honest conversation about why?”",1,"“I want to talk about what you said behind my back, and I hope we can solve the problem”",2,"“I heard you said bad things about me behind my back, can we have an honest conversation about why?”",1,"“I can’t believe you did this, I don't want to be friends anymore”",3,"“I can’t believe you did this, I don't want to be friends anymore”",3
"['""I appreciate your feedback, but I did spend a lot of time on it""', '""Thank you for your honest feedback How about we order some food you like to eat?""', '""I spent a long time making it, so I appreciate your honesty""', '""I\'m sorry to hear that, what do you not like about it?""']",3,"""I spent a long time making it, so I appreciate your honesty""",2,"""I spent a long time making it, so I appreciate your honesty""",2,"""I'm sorry to hear that, what do you not like about it?""",3,"""I'm sorry to hear that, what do you not like about it?""",3,"""I spent a long time making it, so I appreciate your honesty""",2
"['""I\'m sorry you feel this way, but this is what makes me happy""', '""I\'m sorry, but please believe in me, just like I do, and I will do better than you did""', '""I didn\'t expect you to understand my dreams""', '""You\'re right, I\'m ruining my future, aren\'t I?""']",0,"""You're right, I'm ruining my future, aren't I?""",3,"""I'm sorry you feel this way, but this is what makes me happy""",0,"""I didn't expect you to understand my dreams""",2,"""I didn't expect you to understand my dreams""",2,"""I'm sorry, but please believe in me, just like I do, and I will do better than you did""",1
"['""That\'s okay, please don\'t mind, as I don\'t need a friend like you""', '""I knew it was you, I can\'t trust you with anything""', '""I guess the only fair way is for me to scratch yours""', '""It\'s alright, mistakes happen. Please get it repaired""']",3,"""I guess the only fair way is for me to scratch yours""",2,"""That's okay, please don't mind, as I don't need a friend like you""",0,"""It's alright, mistakes happen. Please get it repaired""",-1,"""I guess the only fair way is for me to scratch yours""",2,"""I guess the only fair way is for me to scratch yours""",2
