Choices,Label,Res 1,Pred 1,Res 2,Pred 2,Res 3,Pred 3,Res 4,Pred 4,Res 5,Pred 5
"['""I think you need to be patient and keep working out""', '""I think you should look at your progress and how far you have come""', '""I think you should reassess your workout routine and potentially make some adjustments.""', '""Maybe you need to push yourself more""']",1,"""I think you should reassess your workout routine and potentially make some adjustments.""",-1,"""Maybe you need to push yourself more""",3,"""I think you need to be patient and keep working out""",0,"""I think you should reassess your workout routine and potentially make some adjustments.""",-1,"""I think you should reassess your workout routine and potentially make some adjustments.""",-1
"['""Life is full of rejection. This won\'t be the last time""', '""That\'s okay! Don\'t give up because of one hurdle, that\'s a weak mindset""', '""I know it\'s tough. Don\'t worry, it\'s better than failing your defense, so be careful about that""', '""I think you are doing great! You can learn from your mistakes and create a better proposal""']",3,"""I think you are doing great! You can learn from your mistakes and create a better proposal""",3,"""That's okay! Don't give up because of one hurdle, that's a weak mindset""",1,"""I know it's tough. Don't worry, it's better than failing your defense, so be careful about that""",-1,"""Life is full of rejection. This won't be the last time""",-1,"""Life is full of rejection. This won't be the last time""",-1
"['""Well, you should have played better. We can\'t change the outcome now.""', '""It\'s ok, son. We need to train harder for next time.""', '""It\'s just a game, son. Don\'t worry about it""', '""Losses teach us important lessons about life. Maybe you need a better team.""']",1,"""It's just a game, son. Don't worry about it""",-1,"""It's ok, son. We need to train harder for next time.""",-1,"""It's ok, son. We need to train harder for next time.""",-1,"""Losses teach us important lessons about life. Maybe you need a better team.""",-1,"""Losses teach us important lessons about life. Maybe you need a better team.""",-1
"['""I don\'t like it when you guys argue, tell him to be more mature""', '""Mom, you need to stand up for yourself and fight back""', '""I completely understand. I\'m sure you can figure it out and I\'m here to support you""', '""That\'s not fair to you mom, you should talk to him about it""']",3,"""Mom, you need to stand up for yourself and fight back""",1,"""I don't like it when you guys argue, tell him to be more mature""",0,"""Mom, you need to stand up for yourself and fight back""",1,"""Mom, you need to stand up for yourself and fight back""",1,"""Mom, you need to stand up for yourself and fight back""",1
"['Work harder to compensate', 'Get angry with the workmate', 'Explain the urgency of the situation to the workmate', 'Never rely on that workmate again']",2,Never rely on that workmate again,3,Explain the urgency of the situation to the workmate,2,Get angry with the workmate,1,Never rely on that workmate again,3,Work harder to compensate,0
"['Contact Alexa and arrange to catch up, but also make friends with her replacement', ""Accept that she is gone and it's time for new friendships"", 'Wait for Alexa to contact her so they can catch up and make new friends', 'Spend time getting to know the other people in the office to move on faster']",0,Wait for Alexa to contact her so they can catch up and make new friends,2,"Contact Alexa and arrange to catch up, but also make friends with her replacement",0,Wait for Alexa to contact her so they can catch up and make new friends,2,Spend time getting to know the other people in the office to move on faster,3,"Contact Alexa and arrange to catch up, but also make friends with her replacement",0
"['Take a break to calm down and ask their supervisor for specific feedback', 'Suggest that she find someone else if she is not satisfied with his work', 'Take a break and discuss the issue later when both are calm', 'Apologize to Trudy for any shortcomings in his work and ask for specific feedback']",2,Take a break to calm down and ask their supervisor for specific feedback,0,Take a break and discuss the issue later when both are calm,2,Suggest that she find someone else if she is not satisfied with his work,1,Suggest that she find someone else if she is not satisfied with his work,1,Take a break and discuss the issue later when both are calm,2
"['Tell the other team they must re-do their work', ""Re-do the other team's work to get it up to scratch"", ""Don't worry about it"", 'Tell the project manager about the situation']",3,Tell the project manager about the situation,3,Tell the project manager about the situation,3,Tell the other team they must re-do their work,0,Tell the other team they must re-do their work,0,Tell the project manager about the situation,3
"['See if there is some reasonable explanation for the shift changes', 'Control his emotions and find out if there is a random explanation for the shift changes', 'Come up with a reason to skip working the new shifts', 'Accept the changes and do the shifts']",0,See if there is some reasonable explanation for the shift changes,0,Come up with a reason to skip working the new shifts,2,Accept the changes and do the shifts,3,Come up with a reason to skip working the new shifts,2,Control his emotions and find out if there is a random explanation for the shift changes,1
"['Secretly mention to the waitress how this behavior is making her feel uncomfortable', 'Ignore the profanities and enjoy her meal, as she expected this type of behavior', 'Leave the restaurant and find a more respectful place to eat', 'Confront the waitress about the disrespectful service']",1,Confront the waitress about the disrespectful service,3,"Ignore the profanities and enjoy her meal, as she expected this type of behavior",1,Secretly mention to the waitress how this behavior is making her feel uncomfortable,0,Leave the restaurant and find a more respectful place to eat,2,Leave the restaurant and find a more respectful place to eat,2
"['Give hints to the colleague on workplace etiquette', 'Report the situation to his supervisor', 'Avoid the situation by changing his workstation', 'Start making personal calls at work too']",0,Start making personal calls at work too,3,Report the situation to his supervisor,1,Give hints to the colleague on workplace etiquette,0,Give hints to the colleague on workplace etiquette,0,Report the situation to his supervisor,1
"['Try to ignore the unfair treatment', 'Formally discuss with her issues with human resources', 'Document instances of unfair treatment and talk to human resources', 'Start looking for a new job']",3,Formally discuss with her issues with human resources,1,Formally discuss with her issues with human resources,1,Formally discuss with her issues with human resources,1,Document instances of unfair treatment and talk to human resources,2,Try to ignore the unfair treatment,0
"['Approach her, trying to comfort her regardless of what she says', 'Ensure her that she is not alone and has her support', ""Discuss with others and guess what the colleague's problem is"", 'Leave the colleague alone and let her take care of her emotions']",1,Leave the colleague alone and let her take care of her emotions,3,Discuss with others and guess what the colleague's problem is,2,Discuss with others and guess what the colleague's problem is,2,Discuss with others and guess what the colleague's problem is,2,Leave the colleague alone and let her take care of her emotions,3
"['Ask the HR department to mediate a reconciliation between the two', 'Call a team meeting to discuss workplace civility', 'Ignore the situation as they should find a way to fix their problem', 'Confront the two team members individually to understand their perspectives']",3,Confront the two team members individually to understand their perspectives,3,Ignore the situation as they should find a way to fix their problem,2,Call a team meeting to discuss workplace civility,1,Ignore the situation as they should find a way to fix their problem,2,Ask the HR department to mediate a reconciliation between the two,0
"['Try to learn a new language', 'Avoid involving him in group projects due to the complications', 'Speak to the teacher about the situation', 'Offer to help his new classmate with English after class']",3,Speak to the teacher about the situation,2,Speak to the teacher about the situation,2,Try to learn a new language,0,Try to learn a new language,0,Avoid involving him in group projects due to the complications,1
"['Ask her nicely to deal with her personal problems outside office hours', 'Talk to the boss about the situation', 'Reveal her situation to the team for better understanding', 'Privately offer her some help and support']",3,Reveal her situation to the team for better understanding,2,Talk to the boss about the situation,1,Reveal her situation to the team for better understanding,2,Reveal her situation to the team for better understanding,2,Reveal her situation to the team for better understanding,2
"[""Allocate his colleague's tasks to himself to reduce his workload"", ""Offer to do some of the colleague's work so he can take more breaks"", 'Give his colleague advice on work-life balance', 'Focus on his own work']",2,Give his colleague advice on work-life balance,2,Offer to do some of the colleague's work so he can take more breaks,1,Focus on his own work,3,Offer to do some of the colleague's work so he can take more breaks,1,Allocate his colleague's tasks to himself to reduce his workload,0
"['Communicate with her privately and suggest that she change her behavior', 'Try to avoid being disturbed by her', 'Politely tell the classmate how her behavior affects other students', 'Give feedback to the teacher']",2,Give feedback to the teacher,3,Try to avoid being disturbed by her,1,Try to avoid being disturbed by her,1,Give feedback to the teacher,3,Politely tell the classmate how her behavior affects other students,2
"['Stop sharing ideas during the team meetings and talk to the supervisor directly', 'Address the issue directly with her colleague', 'Publicly take credit for her ideas in the next meeting', 'Ignore the situation and continue sharing ideas']",1,Address the issue directly with her colleague,1,Publicly take credit for her ideas in the next meeting,2,Ignore the situation and continue sharing ideas,3,Ignore the situation and continue sharing ideas,3,Ignore the situation and continue sharing ideas,3
"['Confront others and tell them they must fix the mistake themselves', 'Ignore the problem and fix the mistake yourself', 'Contact someone on another team and point out their mistake and ask them to correct it', 'Enthusiastically help fix the mistake to ensure the quality of the work']",2,Enthusiastically help fix the mistake to ensure the quality of the work,3,Enthusiastically help fix the mistake to ensure the quality of the work,3,Contact someone on another team and point out their mistake and ask them to correct it,2,Confront others and tell them they must fix the mistake themselves,0,Enthusiastically help fix the mistake to ensure the quality of the work,3
"['Explain that malfunctions were not his fault', 'Reprimand the employee for making such accusations', 'Ignore the accusation as it is not important', 'Accept his mistake and apologize to the employee']",0,Reprimand the employee for making such accusations,1,Explain that malfunctions were not his fault,0,Accept his mistake and apologize to the employee,3,Accept his mistake and apologize to the employee,3,Explain that malfunctions were not his fault,0
"['Put things in perspective - it is not the end of the world', 'Argue with her that this is not acceptable', 'Show empathy and understanding as she is probably apologetic for being late', 'Ask for an explanation of her lateness']",3,Argue with her that this is not acceptable,1,Show empathy and understanding as she is probably apologetic for being late,2,Argue with her that this is not acceptable,1,Put things in perspective - it is not the end of the world,0,Show empathy and understanding as she is probably apologetic for being late,2
"['Do some extra training to try and improve', 'Forget about it and leave the team', 'Although he may be bad at sports, remember he is good at other things', 'Discuss with his teammates and ask for explanations']",0,Discuss with his teammates and ask for explanations,3,"Although he may be bad at sports, remember he is good at other things",2,"Although he may be bad at sports, remember he is good at other things",2,Discuss with his teammates and ask for explanations,3,Forget about it and leave the team,1
"['Talk to his boss and express his concern about others being assigned the task', 'Ask his boss to give the job to him', 'Not worry about this unless it happens again', 'Do good work so that he will be given the complex tasks in future']",3,Do good work so that he will be given the complex tasks in future,3,Do good work so that he will be given the complex tasks in future,3,Not worry about this unless it happens again,2,Do good work so that he will be given the complex tasks in future,3,Talk to his boss and express his concern about others being assigned the task,0
"['Talk to her friends or workmates about it', 'Ignore the incident and move on to her next task', 'Think that she has been successful in the past and this client being difficult is not her fault.', 'Calm down by taking deep breaths or going for a short walk']",2,Calm down by taking deep breaths or going for a short walk,3,Talk to her friends or workmates about it,0,Talk to her friends or workmates about it,0,Ignore the incident and move on to her next task,1,Ignore the incident and move on to her next task,1
"['Reach out to Blair and ask if she needs support', 'Find a new cafe and socialize with other coworkers', 'Invite Blair again, maybe rescheduling for another time', ""Don't worry about it, ignore the changes and let Blair be""]",2,"Invite Blair again, maybe rescheduling for another time",2,Find a new cafe and socialize with other coworkers,1,"Don't worry about it, ignore the changes and let Blair be",3,"Invite Blair again, maybe rescheduling for another time",2,Find a new cafe and socialize with other coworkers,1
"['Learn that she should plan ahead for next time', 'Document the lack of resources in her progress report', 'Explain the lack of resources to her boss or to management', ""Don't worry about it.""]",1,Explain the lack of resources to her boss or to management,2,Learn that she should plan ahead for next time,0,Document the lack of resources in her progress report,1,Explain the lack of resources to her boss or to management,2,Learn that she should plan ahead for next time,0
"['Accept the warning and be careful not to go in restricted areas from now on', 'Take a few deep breaths and calm down about it.', ""Explain that she didn't know it was restricted"", 'Think about the unfairness of the situation']",2,Accept the warning and be careful not to go in restricted areas from now on,0,Accept the warning and be careful not to go in restricted areas from now on,0,Explain that she didn't know it was restricted,2,Think about the unfairness of the situation,3,Explain that she didn't know it was restricted,2
"['Report the situation to the professor and ask for suggestions', 'Divide the tasks among the remaining group members', 'Avoid working with the teammate in future group projects', 'Confront the other teammates directly about this lack of involvement instead']",0,Avoid working with the teammate in future group projects,2,Avoid working with the teammate in future group projects,2,Confront the other teammates directly about this lack of involvement instead,3,Divide the tasks among the remaining group members,1,Confront the other teammates directly about this lack of involvement instead,3
"['""I think we need to inform our supervisor. Maybe you can get a chance to fix it""', '""You should have been more careful""', '""Did you double check your report before submitting?""', '""While it\'s daunting, I think owning your mistakes would be the best course to take""']",0,"""While it's daunting, I think owning your mistakes would be the best course to take""",3,"""I think we need to inform our supervisor. Maybe you can get a chance to fix it""",-1,"""Did you double check your report before submitting?""",2,"""Did you double check your report before submitting?""",2,"""Did you double check your report before submitting?""",2
"['""I think you should leave personal problems behind while at work""', '""Oh no! Have you considered taking a break to escape?""', '""That sounds really tough. Do you want to talk about it?""', '""I think things will get better for you soon, be confident.""']",2,"""Oh no! Have you considered taking a break to escape?""",1,"""Oh no! Have you considered taking a break to escape?""",1,"""Oh no! Have you considered taking a break to escape?""",1,"""I think things will get better for you soon, be confident.""",-1,"""I think things will get better for you soon, be confident.""",-1
"['""Let\'s figure it out together and continue to work together in the future.""', '""That must be so hard! I\'m sorry to hear that.""', '"" I think you\'ve done a good enough job, I don\'t understand why the supervisor is so mean.""', '""I think everyone goes through this at some point, cheer up!""']",1,"""I think everyone goes through this at some point, cheer up!""",3,""" I think you've done a good enough job, I don't understand why the supervisor is so mean.""",-1,""" I think you've done a good enough job, I don't understand why the supervisor is so mean.""",-1,"""I think everyone goes through this at some point, cheer up!""",3,"""I think everyone goes through this at some point, cheer up!""",3
"['""It\'s not right to make decisions that can impact everyone\'s performance, we\'re in this together.""', '""I appreciate your generous gesture but you should have discussed it with the team beforehand""', '""That\'s unfair to the team and you should have communicated this beforehand""', '""This is not what a team does. Everyone should have equal chances to play""']",1,"""That's unfair to the team and you should have communicated this beforehand""",2,"""This is not what a team does. Everyone should have equal chances to play""",-1,"""That's unfair to the team and you should have communicated this beforehand""",2,"""I appreciate your generous gesture but you should have discussed it with the team beforehand""",1,"""That's unfair to the team and you should have communicated this beforehand""",2
"['""Can you go back and bring the crucial documents?""', '""Please do not repeat the same mistake the next time""', '""I think you need to have better time management""', '""Everyone makes mistakes. Let\'s see how we can work around it.""']",3,"""Please do not repeat the same mistake the next time""",1,"""Please do not repeat the same mistake the next time""",1,"""Everyone makes mistakes. Let's see how we can work around it.""",-1,"""Please do not repeat the same mistake the next time""",1,"""Can you go back and bring the crucial documents?""",0
"['""I am here with you! Let\'s improve together!""', '""He just wants you to be better at your job.""', '""I\'m really sorry that you\'re dealing with this. Do you need anything?""', '""You should improve on the parts he criticized.""']",0,"""He just wants you to be better at your job.""",-1,"""I'm really sorry that you're dealing with this. Do you need anything?""",-1,"""He just wants you to be better at your job.""",-1,"""You should improve on the parts he criticized.""",-1,"""You should improve on the parts he criticized.""",-1
"['""It\'s okay, I\'m sure we will pass just fine""', '""We all struggle sometimes. Would studying together help?""', '""This class is tough for everyone, you\'re not the only one""', '""I think you should have started studying sooner""']",1,"""It's okay, I'm sure we will pass just fine""",0,"""I think you should have started studying sooner""",3,"""It's okay, I'm sure we will pass just fine""",0,"""It's okay, I'm sure we will pass just fine""",0,"""It's okay, I'm sure we will pass just fine""",0
"['""I think you need to discuss to clarify any misunderstandings""', '""I think you need to have an open discussion about your feelings""', '""I think you can work on the parts he criticized and improve the idea""', '""That sounds awful! Don’t mind about the criticism""']",0,"""I think you need to have an open discussion about your feelings""",1,"""That sounds awful! Don’t mind about the criticism""",3,"""That sounds awful! Don’t mind about the criticism""",3,"""That sounds awful! Don’t mind about the criticism""",3,"""I think you need to have an open discussion about your feelings""",1
"['""I can help you find some extra classes to better understand the material.""', '""Do you need help? We can cheat on the next test together.""', '""That\'s not right! I will tell the teacher about you cheating on the test""', '""I don\'t think cheating is the answer to the problem. You need to find a better study strategy.""']",3,"""That's not right! I will tell the teacher about you cheating on the test""",2,"""That's not right! I will tell the teacher about you cheating on the test""",2,"""I don't think cheating is the answer to the problem. You need to find a better study strategy.""",-1,"""I can help you find some extra classes to better understand the material.""",-1,"""That's not right! I will tell the teacher about you cheating on the test""",2
"['""Here are the things I\'ve done. Feel free to copy them.""', '""You can talk to the professor and ask for extensions for the assignments""', '""I think classes are really important and you shouldn\'t miss those""', '""I think you need to act more responsibly""']",1,"""Here are the things I've done. Feel free to copy them.""",-1,"""You can talk to the professor and ask for extensions for the assignments""",1,"""You can talk to the professor and ask for extensions for the assignments""",1,"""You can talk to the professor and ask for extensions for the assignments""",1,"""I think you need to act more responsibly""",3
"['""Is it difficult for you to do your own tasks?""', '""Please prioritize your work and start managing your time better""', '""We need to work together as a team so please communicate it with us if you have troubles""', '""We will remove you from the team if you keep this up""']",2,"""We will remove you from the team if you keep this up""",3,"""Please prioritize your work and start managing your time better""",1,"""Please prioritize your work and start managing your time better""",1,"""We need to work together as a team so please communicate it with us if you have troubles""",2,"""Is it difficult for you to do your own tasks?""",0
"['""That sounds tough. I think you are overthinking and worrying over something trivial.""', '""I am sorry to hear that! I am here for you!""', '""I understand your concerns, let\'s see how we can make the team more inclusive""', '""Have you considered talking about this to our manager?""']",2,"""Have you considered talking about this to our manager?""",3,"""I understand your concerns, let's see how we can make the team more inclusive""",2,"""I am sorry to hear that! I am here for you!""",1,"""I understand your concerns, let's see how we can make the team more inclusive""",2,"""Have you considered talking about this to our manager?""",3
"['""I will take care of you during this time""', '""I\'m sorry to hear that, that must be awful""', '"" You should take some medications and try to get some rest today""', '""You should drink more hot water and stay hydrated""']",2,"""You should drink more hot water and stay hydrated""",3,""" You should take some medications and try to get some rest today""",2,""" You should take some medications and try to get some rest today""",2,"""I'm sorry to hear that, that must be awful""",1,"""I will take care of you during this time""",0
"['""You should choose your words more carefully next time you speak""', '""I understand how you feel and I think maybe you should clarify your point of view""', '""Let\'s submit this matter to the management and see what they think""', '""No problem, let\'s discuss and resolve the misunderstanding between us""']",3,"""No problem, let's discuss and resolve the misunderstanding between us""",3,"""I understand how you feel and I think maybe you should clarify your point of view""",1,"""No problem, let's discuss and resolve the misunderstanding between us""",3,"""I understand how you feel and I think maybe you should clarify your point of view""",1,"""You should choose your words more carefully next time you speak""",0
"['""You know, having feelings for someone is normal, but it\'s important to consider the consequences""', '""It\'s not right, you should find someone else""', '""Should I talk to our boss about your feelings?""', '""I can introduce you to some male friends that I have. Maybe that can help you find a potential partner""']",0,"""Should I talk to our boss about your feelings?""",2,"""It's not right, you should find someone else""",1,"""Should I talk to our boss about your feelings?""",2,"""It's not right, you should find someone else""",1,"""I can introduce you to some male friends that I have. Maybe that can help you find a potential partner""",-1
