Choices,Label,Res 1,Pred 1,Res 2,Pred 2,Res 3,Pred 3,Res 4,Pred 4,Res 5,Pred 5
"['Confront the bullies herself', 'Promise to keep the secret', 'Suggest her brother to talk to a teacher or a school counselor', 'Inform their parents anyway']",2,Inform their parents anyway,3,Confront the bullies herself,0,Confront the bullies herself,0,Confront the bullies herself,0,Confront the bullies herself,0
"['Cut off communication with her friend for a while', 'Suggest her friend to seek professional help like a therapist', 'Tell her friend to deal with it herself', 'Continuously reassure her friend that everything will be fine']",1,Cut off communication with her friend for a while,0,Cut off communication with her friend for a while,0,Tell her friend to deal with it herself,2,Suggest her friend to seek professional help like a therapist,1,Cut off communication with her friend for a while,0
"[""Respect his friend's privacy but express his willingness to help when ready"", 'Confront his friend for not being transparent', ""Pray for his friend's wellbeing"", 'Offer to help with whatever the personal problem might be without asking what it is']",0,Respect his friend's privacy but express his willingness to help when ready,0,Respect his friend's privacy but express his willingness to help when ready,0,Pray for his friend's wellbeing,2,Offer to help with whatever the personal problem might be without asking what it is,3,Offer to help with whatever the personal problem might be without asking what it is,3
"[""Call the police to report his son's actions"", 'Ground his son without discussing the issue.', 'Arrange a meeting with the store owner for his son to apologize', ""Pay the owner, hoping it's a one-time mistake""]",2,Ground his son without discussing the issue.,-1,Call the police to report his son's actions,0,Ground his son without discussing the issue.,-1,Call the police to report his son's actions,0,Call the police to report his son's actions,0
"['Personally meet and talk to her friends', 'Invite these friends over to their house', 'Discuss her concerns with her daughter', 'Forbid her from seeing these friends']",2,Forbid her from seeing these friends,3,Invite these friends over to their house,1,Personally meet and talk to her friends,0,Forbid her from seeing these friends,3,Personally meet and talk to her friends,0
"['Request a replacement of similar value or style', 'Choose not to lend anything to Andrew in the future', 'Express forgiveness and understanding', ""Mention that it's okay as the t-shirt didn't have any value to him""]",3,Request a replacement of similar value or style,0,Request a replacement of similar value or style,0,Express forgiveness and understanding,2,Request a replacement of similar value or style,0,Express forgiveness and understanding,2
"['Comfort and support him so he can get a good grade next time', 'Help him find a part-time job', 'Offer to pay for his education fee', 'Help him find a full-time job']",1,Help him find a full-time job,3,Offer to pay for his education fee,2,Offer to pay for his education fee,2,Help him find a part-time job,1,Help him find a part-time job,1
"['Ignore his dad and get back in the car, refusing to engage in an argument', 'Apologize to his dad for any driving mistakes he made and try to have a calm conversation about what happened', 'Laugh it off and make a joke about the unexpected and coincidental nature of the situation', 'Walk away from the situation and call his dad later to discuss their concerns calmly and privately']",2,Walk away from the situation and call his dad later to discuss their concerns calmly and privately,3,"Ignore his dad and get back in the car, refusing to engage in an argument",0,"Ignore his dad and get back in the car, refusing to engage in an argument",0,"Ignore his dad and get back in the car, refusing to engage in an argument",0,Laugh it off and make a joke about the unexpected and coincidental nature of the situation,2
"['Respond telling her friend to seek professional help', 'Ignore the texts and continue sleeping', 'Suggest her friend to find a new partner', 'Stay up and lend a listening ear to her friend']",3,Ignore the texts and continue sleeping,1,Stay up and lend a listening ear to her friend,3,Stay up and lend a listening ear to her friend,3,Ignore the texts and continue sleeping,1,Respond telling her friend to seek professional help,0
"['Encourage her to break up with her boyfriend immediately', 'Offer her advice on how to improve their relationship', 'Listen empathetically and offer advice without judgment and consideration', 'Encourage her friend to communicate openly with her boyfriend about their problems']",3,Encourage her to break up with her boyfriend immediately,0,Encourage her friend to communicate openly with her boyfriend about their problems,3,Offer her advice on how to improve their relationship,1,Encourage her to break up with her boyfriend immediately,0,Offer her advice on how to improve their relationship,1
"[""Respect her friend's privacy and not pry further into her financial troubles"", 'Offer emotional support and a listening ear, letting her friend know that she can talk freely', 'Privately share her problem to other friends and ask them for help', 'Have a discussion with her about potential solutions and available resources']",3,"Offer emotional support and a listening ear, letting her friend know that she can talk freely",1,Respect her friend's privacy and not pry further into her financial troubles,0,Privately share her problem to other friends and ask them for help,2,Respect her friend's privacy and not pry further into her financial troubles,0,"Offer emotional support and a listening ear, letting her friend know that she can talk freely",1
"['Find a new teammate', 'Acknowledge his mistake and discuss future plans', 'Carry on doing the project by yourself', 'Show your disappointment to him']",1,Carry on doing the project by yourself,2,Show your disappointment to him,3,Find a new teammate,0,Show your disappointment to him,3,Carry on doing the project by yourself,2
"['Make an effort to contact them but also try to meet people in his new city', 'Try to adjust to life in the new city by joining clubs and activities there', 'Let go of his old friends, who have shown themselves to be unreliable', 'Tell his friends he is disappointed in them for not contacting him.']",0,Make an effort to contact them but also try to meet people in his new city,0,Try to adjust to life in the new city by joining clubs and activities there,1,"Let go of his old friends, who have shown themselves to be unreliable",2,Try to adjust to life in the new city by joining clubs and activities there,1,"Let go of his old friends, who have shown themselves to be unreliable",2
"['Tell her sister she is the idiot', 'Never work appliances in front of her sister or family again', 'Ask her sister to help do it', 'Tell her sister how her comments made her feel while crying']",2,Never work appliances in front of her sister or family again,1,Tell her sister how her comments made her feel while crying,3,Tell her sister she is the idiot,0,Tell her sister how her comments made her feel while crying,3,Ask her sister to help do it,2
"['Keep telling his parents his concern, stressing their importance', ""Believe his parents' claim that they are fine"", 'Frequently visit his family', ""Move into his parents' house.""]",2,Move into his parents' house.,-1,Frequently visit his family,2,Move into his parents' house.,-1,Move into his parents' house.,-1,"Keep telling his parents his concern, stressing their importance",0
"['Accept that there is nothing she can do and wish the best', 'Visit the hospital herself and ask the staff about their condition', 'Let herself cry and express emotion for as long as she feels like', 'Speak to other family members to calm herself and find out what is happening, then visit the hospital']",3,"Speak to other family members to calm herself and find out what is happening, then visit the hospital",3,Visit the hospital herself and ask the staff about their condition,1,"Speak to other family members to calm herself and find out what is happening, then visit the hospital",3,"Speak to other family members to calm herself and find out what is happening, then visit the hospital",3,Let herself cry and express emotion for as long as she feels like,2
"['Clean up the mess himself and not mention it to his sister', 'Ask his sister to clean up the mess as soon as she has the time', 'Assume that his sister will clean it later', 'Tell his sister to clean up the mess right now']",1,Assume that his sister will clean it later,2,Clean up the mess himself and not mention it to his sister,0,Ask his sister to clean up the mess as soon as she has the time,1,Tell his sister to clean up the mess right now,3,Tell his sister to clean up the mess right now,3
"[""Don't buy the items"", 'Hide her own personal store of items from the others', 'Tell her housemates she has a problem with this', 'Introduce a new system for grocery shopping and sharing costs']",3,Don't buy the items,0,Don't buy the items,0,Introduce a new system for grocery shopping and sharing costs,3,Introduce a new system for grocery shopping and sharing costs,3,Tell her housemates she has a problem with this,2
"['Try not to think about it, and go on with her daily life as best she can', 'Isolate herself from her family and try to control her emotions on her own', 'Buy the first ticket back to her hometown', 'Contact her close relatives for information and support']",3,Isolate herself from her family and try to control her emotions on her own,1,Buy the first ticket back to her hometown,2,"Try not to think about it, and go on with her daily life as best she can",0,Isolate herself from her family and try to control her emotions on her own,1,Buy the first ticket back to her hometown,2
"['Tell her sister-in-law these comments upset her', 'Get a new babysitter', 'Tell her only to baby-sit, not to clean.', 'Be grateful her house is being cleaned for free']",0,Get a new babysitter,1,"Tell her only to baby-sit, not to clean.",-1,Be grateful her house is being cleaned for free,3,Tell her sister-in-law these comments upset her,0,Tell her sister-in-law these comments upset her,0
"['Tell his father he is completely wrong', 'Prove him wrong by working hard to succeed at the new job', ""Ignore his father's comments."", 'Think of the positives of the new job']",1,Think of the positives of the new job,3,Prove him wrong by working hard to succeed at the new job,1,Tell his father he is completely wrong,0,Ignore his father's comments.,-1,Tell his father he is completely wrong,0
"['Spend time with other friends, keeping herself busy', 'Think that Dara and her partner will return soon', 'Make sure she keeps in contact through email, phone or letter writing.', 'Forget about Dara']",2,Think that Dara and her partner will return soon,1,"Spend time with other friends, keeping herself busy",0,"Make sure she keeps in contact through email, phone or letter writing.",-1,"Make sure she keeps in contact through email, phone or letter writing.",-1,Forget about Dara,3
"['Be upset about it, but realize there is nothing she can do.', 'Understand that relationships change, but keep calling him from time to time', 'Realize that he is growing up and might not want to spend so much time with his family anymore', 'Make plans to drop by and visit him in person and have a good chat']",1,"Be upset about it, but realize there is nothing she can do.",-1,Realize that he is growing up and might not want to spend so much time with his family anymore,2,"Be upset about it, but realize there is nothing she can do.",-1,Make plans to drop by and visit him in person and have a good chat,3,"Understand that relationships change, but keep calling him from time to time",1
"['Start gradually moving away from his friend due to his character', 'Advise his friend to talk to his wife about this matter', 'Encourage his friend to talk to a relationship counselor', 'Secretly discuss this matter with his friend’s wife about this']",2,Start gradually moving away from his friend due to his character,0,Secretly discuss this matter with his friend’s wife about this,3,Advise his friend to talk to his wife about this matter,1,Secretly discuss this matter with his friend’s wife about this,3,Advise his friend to talk to his wife about this matter,1
"['Help her find resources to deal with a breakup and keep an open line of communication.', 'Offer to take some of the project workload off her', ""Suggest she move on from her ex-boyfriend quickly, as it's affecting her work"", 'Let Maya figure things out in her own time']",0,"Suggest she move on from her ex-boyfriend quickly, as it's affecting her work",2,Offer to take some of the project workload off her,1,Let Maya figure things out in her own time,3,Offer to take some of the project workload off her,1,Offer to take some of the project workload off her,1
"['""Oh my god, what\'s wrong?""', '""I can\'t believe it, we should call our parents with the happy news""', '""Please don\'t cry, I know it\'s hard""', '""I\'m so happy and excited for you!""']",0,"""Please don't cry, I know it's hard""",2,"""Oh my god, what's wrong?""",0,"""Please don't cry, I know it's hard""",2,"""I can't believe it, we should call our parents with the happy news""",1,"""I'm so happy and excited for you!""",3
"['""You always have these stomachaches, go see a doctor""', '""I will take care of you during this time""', '""I\'m sorry to hear that, that must be awful""', '""You should drink more hot water and stay hydrated""']",1,"""You should drink more hot water and stay hydrated""",3,"""I'm sorry to hear that, that must be awful""",2,"""I will take care of you during this time""",1,"""I will take care of you during this time""",1,"""You always have these stomachaches, go see a doctor""",0
"['""You should have probably spent more time studying.""', '""We can study hard together and pass the exam together next time.""', '""The college entrance examination is not everything. Your future is in your hands.""', '""Don\'t be discouraged. Analyze the reasons and work hard to improve next time, and you will definitely achieve better results.""']",2,"""We can study hard together and pass the exam together next time.""",-1,"""We can study hard together and pass the exam together next time.""",-1,"""You should have probably spent more time studying.""",-1,"""The college entrance examination is not everything. Your future is in your hands.""",-1,"""We can study hard together and pass the exam together next time.""",-1
"['""You had a good run with him, focus on the future now""', '""I\'m here for you, you should try to move on quickly""', '""Oh no! you can always get another dog!""', '""I am sure your dog was happy that you are his owner""']",3,"""You had a good run with him, focus on the future now""",0,"""You had a good run with him, focus on the future now""",0,"""You had a good run with him, focus on the future now""",0,"""I'm here for you, you should try to move on quickly""",1,"""I'm here for you, you should try to move on quickly""",1
"['""I can understand how that would feel. Do you want to try not eating?""', '""How about we start working out together?""', '""I\'m so sorry to hear that, you wanna grab some ice cream to cheer up?""', '""Carrying some extra weight is not the end of the world""']",1,"""I can understand how that would feel. Do you want to try not eating?""",-1,"""Carrying some extra weight is not the end of the world""",3,"""Carrying some extra weight is not the end of the world""",3,"""I'm so sorry to hear that, you wanna grab some ice cream to cheer up?""",2,"""How about we start working out together?""",1
"['""That\'s really hard, I\'m here if you need to talk about it""', '""Maybe, it\'s for the best. You never know""', '""Let\'s support her and her life decision""', '""You can always call her when both of you are free""']",3,"""You can always call her when both of you are free""",3,"""Let's support her and her life decision""",2,"""Let's support her and her life decision""",2,"""You can always call her when both of you are free""",3,"""Let's support her and her life decision""",2
"['""Learn from your mistakes and you can pass it one day""', '""Don\'t worry, just keep practicing and you\'ll pass next time""', '""Maybe driving is just not your thing""', '""You can always ride a public transport""']",1,"""Don't worry, just keep practicing and you'll pass next time""",1,"""Learn from your mistakes and you can pass it one day""",0,"""Maybe driving is just not your thing""",2,"""Maybe driving is just not your thing""",2,"""You can always ride a public transport""",3
"['""You should take your responsibility of your actions""', '""I don\'t think that\'s quite the right thing to do""', '""It\'s alright, such things happen. Next time be more cautious""', '""It\'s okay! I would be nervous too if I were you""']",0,"""It's okay! I would be nervous too if I were you""",3,"""It's alright, such things happen. Next time be more cautious""",-1,"""You should take your responsibility of your actions""",0,"""It's okay! I would be nervous too if I were you""",3,"""It's alright, such things happen. Next time be more cautious""",-1
"['""Happiness comes from others and we need relationships to be happy""', '""I\'m here for you, you are not alone""', '""I\'m sorry to hear that, have you considered talking to your boyfriend about this?""', '""I\'m sure you will get into a relationship soon too""']",1,"""I'm here for you, you are not alone""",1,"""I'm sorry to hear that, have you considered talking to your boyfriend about this?""",2,"""I'm sure you will get into a relationship soon too""",3,"""Happiness comes from others and we need relationships to be happy""",0,"""I'm sorry to hear that, have you considered talking to your boyfriend about this?""",2
"['""I can see that you\'re really stressed, let\'s talk about it. Maybe we can figure things out together""', '""Take a break from work and go on a vacation""', '""If you find yourself unhappy and stressed, maybe you should find a different job""', '""That\'s adulting. It hits hard""']",0,"""That's adulting. It hits hard""",-1,"""Take a break from work and go on a vacation""",1,"""That's adulting. It hits hard""",-1,"""Take a break from work and go on a vacation""",1,"""That's adulting. It hits hard""",-1
"['""I think you will improve more if you keep practicing""', '""Woah! This is the best painting I have ever seen""', '""Amazing! Do you want to learn from my friends who actually paint well?', '""Do you think that some lines could be a bit thinner?']",0,"""Amazing! Do you want to learn from my friends who actually paint well?",2,"""I think you will improve more if you keep practicing""",0,"""I think you will improve more if you keep practicing""",0,"""Do you think that some lines could be a bit thinner?",3,"""Do you think that some lines could be a bit thinner?",3
"['""I think you are wrong here. You shouldn\'t cheat""', '""Let\'s pretend this never happened""', '""I think you should be honest and tell him about it""', '""If you are unhappy with your relationship, I\'m sure he will understand""']",2,"""I think you should be honest and tell him about it""",2,"""If you are unhappy with your relationship, I'm sure he will understand""",3,"""If you are unhappy with your relationship, I'm sure he will understand""",3,"""Let's pretend this never happened""",1,"""If you are unhappy with your relationship, I'm sure he will understand""",3
"['""Don\'t worry, you\'re not alone. We will figure this out together""', '""Don\'t worry! I feel the same way when I was with you. Every expecting mothers feel this way.""', '""Remember that you have options in your hands. Do what feels right for you""', '""I think you should discuss this with the baby\'s father""']",0,"""I think you should discuss this with the baby's father""",3,"""Don't worry! I feel the same way when I was with you. Every expecting mothers feel this way.""",-1,"""Remember that you have options in your hands. Do what feels right for you""",-1,"""Remember that you have options in your hands. Do what feels right for you""",-1,"""Remember that you have options in your hands. Do what feels right for you""",-1
"['""I express my condolences to your experience. Sorry, I hope you can find peace and support.""', '""Him passing away is your chance to escape, and I will always support you, no matter what you need.""', '""Don\'t worry, you can talk to me, I will always be here to support you.""', '""You must be feeling very complicated, find a counselor to talk to""']",2,"""Him passing away is your chance to escape, and I will always support you, no matter what you need.""",-1,"""Him passing away is your chance to escape, and I will always support you, no matter what you need.""",-1,"""You must be feeling very complicated, find a counselor to talk to""",3,"""You must be feeling very complicated, find a counselor to talk to""",3,"""I express my condolences to your experience. Sorry, I hope you can find peace and support.""",-1
"['""I appreciate you sharing this with me, let\'s work it out together in a bar nearby""', '""I appreciate you sharing this with me, let\'s work it out together""', '""It\'s not the end of the world, a few drinks a week won\'t hurt you""', '""I think you need to cut down on drinking""']",1,"""I think you need to cut down on drinking""",3,"""I appreciate you sharing this with me, let's work it out together in a bar nearby""",0,"""I appreciate you sharing this with me, let's work it out together in a bar nearby""",0,"""It's not the end of the world, a few drinks a week won't hurt you""",2,"""I think you need to cut down on drinking""",3
"['""Oh, I\'m sorry you\'re feeling like this""', '""Do you wanna try some new hobbies together?""', '""You must get out, you are always inside the house""', '""You need to push through, everyone feels down sometimes.""']",1,"""Oh, I'm sorry you're feeling like this""",0,"""Do you wanna try some new hobbies together?""",1,"""You must get out, you are always inside the house""",2,"""You must get out, you are always inside the house""",2,"""You must get out, you are always inside the house""",2
"['""Don\'t worry, you are not alone. We will figure this out together.""', '""Don\'t be afraid, we can explore together how to embrace to this new role.""', '""I can\'t believe you would put yourself in this situation.""', '""I think you should discuss this with the father of your child.""']",0,"""I can't believe you would put yourself in this situation.""",-1,"""I can't believe you would put yourself in this situation.""",-1,"""I can't believe you would put yourself in this situation.""",-1,"""Don't be afraid, we can explore together how to embrace to this new role.""",-1,"""I can't believe you would put yourself in this situation.""",-1
"['""You should have told us sooner. ""', '""You should have saved more when you had the job""', '""We can lend you some money until you get back on your two feet""', '""We are truly sorry for your situation but we know you can make it""']",2,"""You should have told us sooner. """,-1,"""You should have saved more when you had the job""",1,"""We can lend you some money until you get back on your two feet""",2,"""We can lend you some money until you get back on your two feet""",2,"""We can lend you some money until you get back on your two feet""",2
"['“We can discover our shortcomings by comparing ourselves and working on those”', '“I think this feeling is normal. But don’t let it eat you up.”', '“You are doing a great job, it’s amazing! Just be yourself”', '“You should choose the field that suits you best”']",0,“You should choose the field that suits you best”,3,"“You are doing a great job, it’s amazing! Just be yourself”",2,“We can discover our shortcomings by comparing ourselves and working on those”,0,“We can discover our shortcomings by comparing ourselves and working on those”,0,“I think this feeling is normal. But don’t let it eat you up.”,-1
"['""Divorce her, she isn\'t worth your time""', '""Are you sure? Maybe you are misunderstanding her""', '""I think you should have a heart-to-heart discussion with mom and figure out the next step""', '""Do what you think it\'s right for you dad. I am here to support you""']",2,"""I think you should have a heart-to-heart discussion with mom and figure out the next step""",2,"""I think you should have a heart-to-heart discussion with mom and figure out the next step""",2,"""Are you sure? Maybe you are misunderstanding her""",1,"""Divorce her, she isn't worth your time""",0,"""Do what you think it's right for you dad. I am here to support you""",-1
"['""I think you need to take better care of your skin""', '""I am sorry to hear that. I like you because of your personality, not your skin, but not all people are the same""', '""Your value is not defined by how clear and flawless your skin is. Work on your personality""', '""I can share my skincare tips with you to help with the acne""']",3,"""I think you need to take better care of your skin""",0,"""I think you need to take better care of your skin""",0,"""I am sorry to hear that. I like you because of your personality, not your skin, but not all people are the same""",-1,"""I am sorry to hear that. I like you because of your personality, not your skin, but not all people are the same""",-1,"""Your value is not defined by how clear and flawless your skin is. Work on your personality""",-1
